n12078204,王友群：中共创始人李达文革中被整死
n12089232,掸封尘：彭德怀怒吼“我不吃毛泽东的饭！”
n12095094,掸封尘：“胡汉三”的演技成全的欺世大谎
n12095397,王友群：1959年发生的涉江青特大政治案
n12114578,王友群：助中共赢辽沈战役被中共判无期的特务
n12125367,造锅甩锅姊妹篇：“卡廷惨案”到“中共病毒”
n12130433,王凤昌：为民国献身的中华英烈王泽浚将军
n12131739,王友群：公安部副部长徐子荣文革被整死之谜
n12135829,李江琳：中国人的仇美情绪从何而来
n12138808,二大爷：希特勒的1936：世界为何会坐视纳粹毁约
n12146726,王友群：选择投奔中共 一代英才自杀
n12148208,曾伯炎：起底两个30年
n12156258,宁先华：纪念六四，天安门拒绝遗忘
n12164714,张菁：东德秘密警察史塔西对个体的监控
n12166466,王友群：为中共唱赞歌的黄炎培一家9人挨整
n12171682,鲍彤：闯祸不认错是中共的传统
n12179695,王友群：安徽大跃进饿死500万人之谜
n12191867,二大爷：美国共产党今昔
n12197974,曾铮：中美“文革”之九大对比
n12201122,王友群：林彪之女林豆豆被整得死去活来
n12201420,金岩：各国除垢史回顾
n12216273,王友群：刘少奇长子刘允斌文革中卧轨自杀
n12218068,芳子：北京城里细管胡同
n12231002,王友群：给刘少奇沉重打击的一张大字报
n12239161,武汉肺炎觅因：历史上的冤狱与天灾
n12240806,掸封尘：文革奇闻——红色劫匪举办战利品展览会
n12245403,古有赵高指鹿为马  今有中共指龙为鲸
n12251034,王友群：38次为毛泽东“做警卫”文革挨整8年多
n12264446,清奇：谁使花中仙子叶凋零
n12268703,王友群：紧跟毛泽东 砸烂公检法 刘传新最后自杀
n12272112,田园：中共对抗美国 华人何去何从？（上）
n12273037,田园：中共对抗美国 华人何去何从？（下）
n12284372,缘茽：鬼畏正神
n12285254,王友群：林伯渠第四任妻子朱明自杀之谜
n12290918,二大爷：大清挨揍，百姓都干嘛去了？
n12294248,清奇：不死的中国——一首军歌背后的血泪故事
n12296164,王友群：中共特务无孔不入 连蒋介石身边也有
n12300318,廖远：唐山大地震中的“青龙奇迹”
n12300771,【历史回眸】为中国献身的美国飞行员
n12313614,田园：经济内循环 开启中共国崩溃之门
n12316261,王友群：秦城监狱喊“打倒法西斯”的中共高官
n12332573,沈舟：太平洋海战系列 首战显空中优势
n12334243,王友群：北京市委第二书记刘仁被整死之谜
n12334577,史翔：胡适的千年一叹
n12335597,张林：1958年，7亿中国人斩尽杀绝20亿麻雀！
n12346464,为什么中共要将台湾视为自己的“核心利益”？
n12347836,慧眼识魔：历史的绝响引人深思
n12351777,沈舟：太平洋海战系列 爪哇海战役
n12352171,1949年后乐山大佛首次洗脚为何受关注
n12354397,王友群：北京大学副校长翦伯赞文革自杀之谜
n12362166,立言：卢作孚们的前世今生
n12365416,王友群：痛斥“毛泽东是大骗子”的大右派戴煌
n12368011,沈舟：太平洋海战系列 航母逞威印度洋
n12382837,袁斌：抗战胜利的中流砥柱是中共还是国民党？
n12383514,太平洋海战系列 史上首次航母对战（上）
n12384788,王友群：敢痛斥毛泽东的大作家聂绀弩
n12398861,观雨堂主：重温梁实秋之政治评论
n12400746,太平洋海战系列 史上首次航母对战（下）
n12401445,王友群：毛泽东翻脸 罗瑞卿被逼跳楼
n12409364,沈舟：航空母舰是如何诞生的
n12411588,刘超祺：九一八事变
n12414650,王友群：大银行家被中共“共产”成“穷光蛋”
n12415486,关乐：一二‧九
n12416281,二大爷：流落国三十年，美孤女悲喜交织的回家路
n12416495,沈舟：太平洋海战系列 航母决战中途岛
n12431207,王友群：中宣部长陆定一文革被关秦城监狱之谜
n12433518,理悟：摘桃——还原抗战真相
n12431501,太平洋海战系列 所罗门群岛航母苦战
n12444184,观雨堂主：徐志摩的警世箴言
n12449147,太平洋海战系列 所罗门群岛航母苦战（中）
n12452549,王友群：中共上将张爱萍文革中差点被“毒死”
n12465303,王友群：中共海军副司令陶勇“投井自杀”之谜
n12465988,太平洋海战系列 所罗门群岛航母苦战（下）
n12474860,朱瑞霞：于湾冤魂终古在，楚乡旧事扰人宁（ㄧ）
n12478902,美国中文教师：致中国人心灵的一封信
n12475358,朱瑞霞：于湾冤魂终古在，楚乡旧事扰人宁（二）
n12481413,王友群：先帮中共使劲整人后被整死的吴晗
n12475346,朱瑞霞：于湾冤魂终古在，楚乡旧事扰人宁（三）
n12482218,太平洋海战系列 史上最大规模航母对战
n12493405,王君：从朝鲜战争谁先开战看中共的谎言
n12495587,乾元：邪恶的中共到底从朝鲜战争得到了什么？
n12496822,王君：搞共产主义是中共出兵朝鲜的根本起因
n12497755,王赫：毛泽东为什么非要“抗美援朝”？
n12498930,陆言：一段被中共掩盖的卸磨杀驴的悲惨历史
n12498883,王友群：公安部副部长杨奇清被关秦城监狱之谜
n12498278,太平洋海战系列 史上最大规模海战
n12504522,袁斌：共产党倒台后的“公务员们”
n12504543,《纽约时报》如何掩盖乌克兰大饥荒
n12506994,袁斌：抗美援朝中共不但输了 而且输得很惨
n12508055,王君：二战后美军有侵略中国的战略吗？
n12509050,袁斌：子虚乌有的“黄继光堵枪眼”
n12516352,王君：韩战前后美国有侵犯中国的图谋吗？
n12516533,林辉： 唱打败美帝者移民美国 奇袭白虎团有真相
n12516699,袁斌：凭空编造的红军“飞夺泸定桥”
n12518019,王君：出兵朝鲜不是中国人民的意愿
n12516400,登陆作战有多难 美军夺取塞班岛的苦战
n12518228,王友群：毛泽东秘书李锐三次挨整的经历
n12520725,高寒：顺天意者昌 逆天意者亡
n12521064,袁斌：中共早期农民运动“好得很”？
n12521559,王君：和平谈判证明美国没有侵略中国的战略
n12522846,袁斌：周扒皮与《半夜鸡叫》
n12526384,王君：联合国大会认定中共介入朝鲜是侵略行为
n12526408,袁斌：黄霸天与《白毛女》
n12529816,王君：苏联“无偿”支援韩战武器是场共产主义恶梦
n12531043,王友群：与江青结怨的许建国最后气绝身亡
n12531179,袁斌：“水稻亩产130,434.14斤”的惊天谎言
n12533175,王君：热血轻洒亡命他乡究竟为了什么？
n12531356,登陆作战有多难 夺取关岛和天宁岛之战
n12543233,袁斌：“神奇的地雷战”？ 压根就没那回事！
n12549716,王友群：北京副市长崔月犂文革入狱曾被关疯了
n12548429,登陆作战有多难 血战贝里琉岛
n12560012,袁斌：“蒋介石背叛革命”纯属弥天大谎
n12560442,二大爷：中国人的生与死
n12560920,邢天行：宋庆龄致命中国的几件事
n12566737,王友群：中共上将赵尔陆文革“猝死”之谜
n12565118,登陆作战有多难 残酷的硫磺岛战役
n12578065,邢天行：从川普的遭遇感怀蒋介石
n12582248,王友群：中共高级特工王超北被中共关押17年
n12583649,林辉：中共首任国安部长凌云的歧途
n12580656,登陆作战有多难 太平洋最大的冲绳岛登陆
n12596704,王友群：中监委高官王世英被迫害致死之谜
n12597490,【微历史】恩格斯百年阴谋 结出2020美大选恶果
n12597411,沈舟：世界上的首次航母空袭
n12600801,警世钟：明朝“靖难之役”与美国“正邪之战”
n12601721,沈舟：1941年珍珠港空袭对今天的启示
n12605351,袁斌：中共诱骗民众常用的两大招数
n12614357,王友群：毛泽东夸奖的“大作家”被关秦城监狱7年
n12619305,唐伟：勿忘历史教训 勿成中共的“空降兵”
n12619377,史鉴：法官、检察官、政要失职将带来灾难
n12618414,邢天行：血战长津湖 被中共掩盖的骇人真相（1）
n12627353,邢天行：血战长津湖 中共隐瞒的骇人真相（二）
n12632422,林辉：文革由毛像引发的荒诞事
n12632697,王友群：北京大学文革中第一个自杀的教授
n12635503,张菁：文革中演样板戏《红灯记》招致的厄运
n12646319,吴侃：从中华民国败走看今天的美国
n12646958,邢天行：长津湖“全歼北极熊团”的谎言
n12647789,王友群：我的老领导刘丽英一家文革蒙难记
n12652423,拨云：美国三次误判中共的历史教训（一）
n12651974,张菁：因相信党妈 儿子被亲妈送上黄泉路
n12655409,拨云：美国三次误判中共的历史教训（二）
n12657865,拨云：美国三次误判中共的历史教训（三）
n12658168,中共“救命恩人” 著名法学家被整家破人亡
n12668082,王君：联合国大会认定中共介入朝鲜是侵略行为
n12676333,曾为中共收集战略情报 阎宝航被中共折磨致死
n12678112,回忆录：右派家属母子的百年血泪（1）
n12679159,张菁：他死后，手指被削下来泡在福尔马林中
n12679738,回忆录：右派家属母子的百年血泪（2）
n12683820,回忆录：右派家属母子的百年血泪（3）
n12685099,观雨堂主：吴晗的双重人格
n12686410,回忆录：右派家属母子的百年血泪（4）
n12690994,王友群：文革中石破天惊的“万言书”
n12692515,回忆录：右派家属母子的百年血泪（5）
n12693887,张菁：太残酷 哺乳期的她乳头被烧焦
n12698863,回忆录：右派家属母子的百年血泪（6）
n12702665,郭军：“黑五类”子女解析“黑五类”
n12706141,王友群：被中共判刑十年的杰出法学家盛振为
n12706191,回忆录：右派家属母子的百年血泪（7）
n12709128,张菁：文革时 形形色色五花八门的吊刑
n12706196,回忆录：右派家属母子的百年血泪（8）
n12717578,邢天行：麦克阿瑟将军的朝鲜好牌被谁打坏了
n12720302,袁斌：中共关于国军不抗日的谎言
n12721487,王友群：毛泽东翻脸不认人 中监委高官被整死
n12722926,张菁：文革时 那口没人敢用的棺材
n12723511,袁斌：一个全家被共产党杀光的故事
n12724108,杨宁：嫉妒小人江泽民 炮制世纪伪案
n12727790,颜智华：百年来共产党要了多少人的身家性命？
n12727840,袁斌：中共是“抗日战争的中流砥柱”？
n12729946,王赫：对中共早期在美渗透行动之反思
n12736110,王友群：做好事成罪状 首任中共监察部长被整死
n12737290,李正宽：大疫汹汹 人类会不会重蹈覆辙？
n12738476,阿伦：知道你的手机怎么监听你的么(上)？
n12740955,【微历史】共产党利用民主在三国夺权：中国篇
n12751238,王友群：中共美女间谍陈修良被中共整肃22年
n12758981,邢天行：麦克阿瑟的链锁赤龙与“不沉航母”（上）
n12761975,邢天行：麦克阿瑟的链锁赤龙与“不沉航母”（下）
n12763411,王友群：黄克诚庐山讲真话 被整得死去活来
n12765924,张菁：文革期间惨烈的批斗会
n12772931,张菁：文革中改名换姓的笑话
n12777952,毛泽东的大笔杆子姚文元被关秦城监狱20年
n12783005,张菁：上山下乡运动——轰出城市
n12792913,王友群：天才物理学家束星北晚年拒绝加入中共
n12796743,袁斌：“秋收起义”的真相
n12809869,王友群：第一任中共党魁陈独秀的最后结局
n12810247,袁斌：“红军飞夺泸定桥”不过是个荒唐的骗局
n12811020,张菁：上山下乡欢迎会上的忆苦饭和教育课
n12816694,袁斌：红军长征根本就不是为了北上抗日
n12818006,张菁：从文革小笑话看中国人的善如何被毁掉
n12824710,王友群：第二任中共党魁瞿秋白的最后结局
n12825833,张菁：上山下乡运动中那些逝去的生命
n12829845,袁斌：真实的地雷战根本不是中共吹嘘的那样
n12834884,时欣：为什么远离苏联的国家都好了？
n12836541,百年沉思：她们鲜为人知的命运诉说了什么？
n12839888,张菁：文革笑话——认认真真走过场
n12840390,王友群：中共第三任党魁向忠发的最后结局
n12844679,蔡慎坤：历史的吊诡之处
n12850959,袁斌：所谓“平型关大捷”的真相
n12855290,王友群：第四任中共党魁秦邦宪的最后结局
n12857212,中共罪行录之一：抗日英雄胡树基之死
n12857793,张菁：画家被自己的老婆送入鬼门关
n12861087,袁斌：遵义会议确立了毛泽东在中共的领导地位？
n12863644,中共罪行录之二：消灭AB团和富田事变
n12865420,王友群：第五任中共党魁张闻天的最后结局
n12865576,袁斌：“新三民主义”完全是中共的捏造
n12868914,中共罪行录之三：“西路军”的覆灭
n12871492,袁斌：中共是马列与工人运动相结合的产物？
n12872817,张菁： 牛棚里剃“阴阳头”的“牛鬼蛇神”
n12872820,【史鉴】82岁前中共县长的灭顶之灾
n12872832,王友群：习近平的父亲留下的四大遗产
n12881305,中共罪行录之四：陕甘宁边区的鸦片贸易
n12883993,中共罪行录之五：一字之差成了反革命
n12882305,周晓辉：“三大纪律”下的绑票与中共建国中国
n12886353,中共罪行录之六：毛时代的腐败
n12887429,中共罪行录之七：百岁老人笔下的中共黑幕
n12888201,王友群：第九任中共党魁赵紫阳的最后结局
n12888565,张菁：文革中践踏人尊严的学习班
n12887922,李勇：中共早年在香港纽约制造暴力恐怖纪实
n12892171,袁斌：“皖南事变”是“千古奇冤”？
n12892901,法国思想家托克维尔诠释堕入暴政的过程
n12897365,中共罪行录之八：装甲兵司令员被活活整死
n12902918,王友群：第八任中共党魁胡耀邦的最后结局
n12904529,张菁：文化大革命九十号及精神变物质
n12905134,一部反人类犯罪的历史——中共百年历史谈
n12905872,中共罪行之十：所谓“六四反革命暴乱”
n12908179,中共罪行录之十一：延安整风
n12910568,袁斌：抗战胜利后谁挑起了内战？
n12914429,周晓辉：东方红曲调来自情歌 延安进行文革预演
n12917801,袁斌：还原“恶霸地主刘文彩”的真相
n12918879,袁斌：还原“恶霸地主黄世仁”的真相
n12919443,亦然：改了又改的党史和无法改变的事实
n12920034,叶书：165名中共空军 “反革命”累计改造逾3600年
n12921133,袁斌：编造出来的“南霸天”
n12921925,张菁： 反右中一根绳子吊死一对夫妻
n12921960,周晓辉：中共开七大时暗中勾结日军 后感谢侵华
n12918457,王友群：第七任中共党魁华国锋的最后结局
n10757327,共产暴政录：长春围城饿毙几十万人真相
n12923274,袁斌：“周扒皮”的故事纯属虚构
n12925599,袁斌：子虚乌有的“资产阶级右派的猖狂进攻”
n12928000,中共罪行录之十二：“无产阶级文化大革命”
n12933748,王友群：第十任中共党魁江泽民面临的最后结局
n12938801,袁斌：毛的帝王般生活 却宣传成“与人民同甘共苦”
n12952850,花丛中的骑士：骑士精神简史
n12954229,王友群：批“党天下”的大右派储安平失踪之谜
n12957562,袁斌：“延安整风”中毛泽东是怎样伪造中共历史的
n12959911,中共罪行录之十三：在河北安国县的勒索和欺诈
n12962619,中共罪行录之十四：在太行山区摧毁传统文化
n12965097,中共罪行录之十五：吕正操所部残杀异己
n12967431,中共罪行录之十六：强迫孩子现场看杀人
n12970477,张菁：文革中各种残酷的“站刑”和“坐刑”
n12971424,中共罪行录之十七：大饥荒中的“荥经惨案”
n12974074,中共罪行录之十八：“文革”新贵们的贪腐（上）
n12974507,传奇企业家：失败不可怕 吸取教训勇于尝试
n12976431,中共罪行录之十九：“文革”新贵们的贪腐（下）
n12978961,中共罪行录之二十：“打土豪”
n12984234,袁斌：“六十一个阶级兄弟”中毒事件真相
n12986487,张菁：她被逼每日吃一顿抹着秽物的窝头
n12987500,中共罪行录之二十一：所谓的“清除精神污染”
n12986411,被遗忘的百年历史（I）1920至1950
n12989161,被遗忘的百年历史（II）1950 至1976
n12991962,被遗忘的百年历史（III）1976至1989
n12991772,王友群：毛泽东的接班人刘少奇之死
n12998426,中共罪行录之二十二：少年“反革命”
n12997401,王友群：毛泽东的接班人林彪之死
n13002345,韩战时美国排华风暴 纽约华人曾如何应付危局
n13002424,高僧：你办案时心里真有国法吗？
n13003575,张菁：中共“长征”中的绑票筹款亲历者
n13004467,李勇：历史秘闻——张学良自评历史功过
n13009729,中共罪行录之二十三：三年级的“地主分子”
n13011888,【中共党史】建党的罪恶本质：苏联豢养
n13012901,【名家专栏】人口炸弹突然成了人口泡沫
n13015342,中共罪行录之二十四：被冤杀的“伪乡长”
n13001609,被遗忘的百年历史（V）2001至2005
n13016395,王友群：延安的1万5千个特务是怎么回事？
n13018945,中共罪行录之二十五：87种害人招式
n13020167,【中共党史】中共配合苏联侵略中国（上）
n13020296,叶书：中共 “红船精神”真相 谎话连篇的党史
n13020354,苏共出钱出枪换取孙中山接纳中共“借壳上市”
n13020585,张菁：长征是溃败逃亡还是北上抗日？
n13020689,中共罪行录之二十六：“文革”整人四大招
n13023054,中共罪行录之二十七：为句真话劳改15年
n13022783,中东路事件：中共配合苏联侵略中国（下）
n13001669,被遗忘的百年历史（VI）2001至2021
n13030146,首位文革杀人犯的忏悔：革命逆天、人命关天
n13030600,中共罪行录之二十八：切菜切出反革命
n13030262,【中共党史】中共配合苏联肢解中国（上）
n13031965,林辉：行刑时绞刑台上热搜 李大钊叛国罪难掩
n13032288,王友群：毛泽东的接班人王洪文之死
n13033620,共产党的发展壮大与国民党内右派的反击（一）
n13033754,叶书：邓拓愚忠的遗言与江青“免责”辩护词
n13034811,叶书：中共百年“党罄” 高官叛逃吹响末日前奏
n13034638,再现历史中的浮士德故事
n13033683,共产党的发展壮大与国民党内右派的反击（二）
n13035660,【中共党史】中共配合苏联肢解中国（下）
n13035206,林辉：中共三名高官叛逃带来的重创
n13036513,中共罪行录之二十九：没头的尸体一大片
n13036965,美国国父的教导：从历史中吸取无穷智慧
n13038692,中共罪行录之三十：访民刘耀明之死
n13039529,周晓辉： 国企改革毁掉东北 肥了中共权贵集团
n13040700,【中共党史】配合苏联肢解中国 分裂新疆
n13043864,湖南的农民运动——共产党农村土改运动的预演
n13044327,中共罪行录之三十一：邓星杞一家之死
n13046662,中共罪行录之三十二：一句话右派
n13001762,被遗忘的百年历史（VII） 1949至2020
n13049849,周恩来下令杀顾顺章家十多人是怎么回事？
n13049996,杨箭：百年中共的百年罪恶
n13050025,共产党在中国城市发动“反帝”革命运动（上）
n13050342,中共罪行录之三十三：钦州剖腹食肝风
n13052583,颜智华：共产主义是国际恐怖主义
n13051791,【百年透视】中共暴政的杀人历史
n13056050,【中共党史】苏联扶共侵华阴谋的大揭发
n13057253,【百年透视】中共摧毁传统文化与道德
n13014567,【百年透视】中共是全世界最大的卖国党
n13058998,【中共党史】中共武装割据中的苏联军援
n13059947,袁斌：中共是全世界杀人最多的刽子手党
n13048188,被遗忘的百年历史（VIII）1949至2020
n13062650,袁斌：中共是全世界最爱撒谎的骗子党
n13062711,【网海拾贝】中共的本质是两面派的骗子
n13064563,【百年透视】教科书里谎言知多少？
n13064758,袁斌：中共是全世界最野蛮霸道的强盗党
n13064830,【百年透视】剖析中共洗脑术
n13065827,【百年透视】中共为祸百年的深层原因
n13065845,【百年透视】抗击中共为何成为国际潮流？
n13065420,韩亦言：中国共产党的初心是什么？
n13067282,王友群：出席中共一大的15人的最后结局
n13068366,袁斌：中共是全世界最残暴无道的独裁党
n13076119,共产党在中国城市发动“反帝”革命运动（下）
n13074576,【中共党史】中共武装割据中的“红色基因”
n13078336,颜智华：国共合作以共产党惨败收场（1）
n13048246,被遗忘的百年历史（Ⅸ）1919 至2021
n13079964,颜智华：国共合作以共产党惨败收场（2）
n13080359,袁斌：中共是全世界奉送领土最多的卖国党
n13081595,颜智华：国共合作以共产党惨败收场（3）
n13082967,颜智华：国共合作以共产党惨败收场（4）
n13084645,王友群：北京大学教授王重民文革中悬梁自尽
n13087993,中共罪行录之三十四：大饥荒时代的悲惨故事
n13093007,中共罪行录之三十五：乡村大游斗     
n13093178,颜智华：落草为寇的朱毛为何能立足并壮大（1）
n13095103,颜智华：落草为寇的朱毛武装为什么能立足并壮大（2）
n13095149,中共罪行录之三十六：西藏的文革惨剧
n13096576,中共罪行录之三十七：卫生纸之祸
n13096652,颜智华：共产党在苏区的烧杀抢反人类犯罪（1）
n13099553,中共罪行录之三十八：现代“窦娥冤”
n13101108,颜智华：共产党在苏区的烧杀抢反人类犯罪（2）
n13101149,中共罪行录之三十九：一声口哨一条命
n13099858,王友群：第一个挨整的中共元帅刘伯承
n13103760,中共罪行录之四十：滴血的手指头
n13103846,颜智华：中原大战结束 为何共产党还能在赣南闽西折腾4年
n13107819,中共罪行录之四十一：剃光头也有罪
n13109642,颜智华：“剿共战争”成派系斗争筹码 红军逃生作乱  
n13109759,苏晓康：垮坝
n13111808,王友琴：文革猛于虎——记文革受难者张为申和谢瑞瑾
n13113015,中共罪行录之四十二：语录对错招来祸
n13112821,王友群：被整得最惨的中共元帅彭德怀
n13115989,中共罪行录之四十三：名字惹的祸
n13128622,王友群：林彪之子林立果痛斥毛泽东为暴君
n13129563,【名家专栏】《西游记》教我们认清中共欺骗
n13130302,中共罪行录之四十四：“红色恐怖万岁”
n13132408,中共罪行录之四十五：“阴阳头”和“喷气式”
n13148878,金言：古代童谣何以预示王朝的灭亡？
n13149032,观雨堂主：中共对美国的仇恨永远不会放弃
n13150966,王友群：北京大学一级教授向达文革被迫害致死
n13159737,袁斌：罗素对“俄国革命”的洞见
n13161711,王友群：因毛泽东一句话 部长张霖之文革被打死
n13172779,中共罪行录之四十六：红歌作者的悲惨结果
n13175568,中共罪行录之四十七：被割喉的张志新们
n13177975,中共罪行录之四十八：死囚家属学习班
n13177158,王友群：毛泽东发动大跃进 饿死四千万人
n13180822,观雨堂主：红色鹰犬的下场
n13181650,我们从小到大学到的历史哪些是假的（1）
n13186560,我们从小到大学到的历史哪些是假的（2）
n13186855,【名家专栏】不能加入私人俱乐部背后的怨恨
n13190519,百年大梦：2021 终点
n13193945,袁斌：我们从小到大学到的历史哪些是假的（3）
n13192762,百年红祸 中华“亡国”
n13198300,吴明：中共历届“克格勃”的命运（上）
n13200899,吴明：中共历届“克格勃”的命运（下）
n13204742,袁斌：我们从小到大学到的历史哪些是假的（4）
n13208826,林辉：真“双枪老太婆”抗日反共 中共混淆视听
n13196066,告别进化论
n13209835,袁斌：我们从小到大学到的历史哪些是假的（5）
n13210760,王友群：中共高级特工潘汉年被监禁至死之谜
n13216206,中共罪行录之四十九：川大最后一个“右派”
n13218798,中共罪行录之五十：同仁堂的故事
n13221126,袁斌：我们从小到大学到的历史哪些是假的（6）
n13196137,无神论——人类面临的最危险骗局
n13225932,中共罪行录之五十一：死于文革的著名作家
n13226435,金言：古代帝王降生有哪些异象？
n13227610,袁斌：我们从小到大学到的历史哪些是假的（7）
n13226398,【名家专栏】不太惬意的夏日时光
n13229461,中共罪行录之五十一：死于文革的著名艺术家
n13231576,王友群：1975年河南溃坝23万人死亡之谜
n13238181,袁斌：我们从小到大学到的历史哪些是假的（8）
n13238349,周傥：共产党统治下绝没有自由——记胡适和陈垣的一段历史公案
n13243175,袁斌：我们从小到大学到的历史哪些是假的（9）
n13244038,王友群：傅作义身边的中共间谍阎又文
n13244136,林辉：王洪文两个“没想到” 遭酷刑被关秦城
n13247326,中共罪行录之五十二：以革命的名义杀人
n13248164,林辉：江青文艺界三大走卒之悲剧人生
n13249512,中共罪行录之五十三：“文革”中被逼自杀的科学家
n13252177,袁斌：我们从小到大学到的历史哪些是假的（10）
n13257311,中共是怎么为自己涂脂抹粉的（1）
n13257369,【网海拾贝】港府以危害国安为名已拘捕153港人
