n4665450,雪笠、公鸣：信仰恒久 经年愈坚
n4665699,林辉：还原中共“英雄模范”之江上青
n4667745,林辉：还原中共“英雄模范”之方志敏
n4668900,林辉：还原中共“英雄模范”之向警予
n4668904,墓碑——大饥荒纪实
n7435119,中共卖国之五：割让长白山天池给朝鲜
n7446851,林辉：还原中共“英雄模范”之吉鸿昌
n7458773,林皎皎：“向科学进军”拉开反右运动序幕
n7462902,林辉：还原中共“英雄模范”之杨开慧
n7471131,鲜为人知的蒋介石“抢救大陆学人计划”
n7475143,林辉：还原中共“英雄模范”之瞿秋白
n7474543,这三件奇闻给现代人带来重要警示
n7480979,大陆人不熟悉的蒋中正轶事
n7481309,内控分子——被共产党内部严密控制的人群！
n7500351,林辉：还原中共“英雄模范”之毛泽民
n7509842,石非：纪登奎儿子揭河南溃坝巨祸内幕
n7518911,瓶中喵：拒绝鼓掌拒绝致敬的人
n7522266,林辉：还原中共“英雄模范”之周文雍陈铁军
n7537433,文革五十周年：文革的必然性和发生的条件
n7537857,林辉：还原中共“英雄模范”之刘胡兰
n7542557,林辉：文革批判爱因斯坦和相对论的闹剧
n7544768,张东园：人在走路时 转弯最重要
n7546513,林辉：还原中共“英雄模范”之杨子荣
n7553881,林辉：还原中共“英雄模范”之张思德
n7559516,沉静：听姥姥讲往事
n7560071,老乐：白天不懂夜的黑 西方不懂东方贼
n7530952,夏祷：国父孙中山画像君临天安门广场
n7567336,林辉：还原中共“英雄模范”之黄公略
n7577374,宇祥：风霁月 人品如莲
n7578757,林辉：还原中共“英雄模范”之江姐
n7579554,山人：日军侵华高官与毛泽东谁更没人性
n7633908,胡平：读戚本禹《回忆江青》有感
n7694344,林辉：还原中共“英雄模范”之左权
n7755764,佚名：爱吃“玉仙羹”的周恩来
n7784303,蔡慎坤：警惕林昭的悲剧在中国重演
n7791814,傅国涌：未名湖畔的痛哭
n7797570,林辉：大跃进时“觉悟票”出炉背后
n7862419,林辉：秦城监狱潘扬案主角一死一疯
n7870446,【文史】你不了解的孙权 开疆拓土三分天下
n7885920,张东园：一念可感天动地——“枯井卫瞽”的故事
n7893989,人民“好总理”周恩来竟杀人如麻
n7901754,无眠：文革50周年祭
n7905067,陈乐陵：袭击造反大楼
n7905657,高天韵：文革──党性杀人 变人为魔
n7912168,薛伟：文化大革命在中国
n7925447,王凤昌：抗战初期的四川省主席王缵绪辞官抗战
n7925614,史求真：毛泽东的遗产──一穷二黑
n7930211,善言：“你不该抵罪，我不该绝后！”
n7931406,宋慧敏：船翻了友谊还在
n7932765,横河：文革反思 刘少奇为什么斗不过毛泽东
n7935926,佚名：“土改”摧毁了中华民族的所有道德和传统
n7938426,林辉：还原中共“英雄模范”之李公朴闻一多
n7944858,叶观星：为什么会有文化大革命
n7948988,孟醒：东方辛德勒──二战中营救犹太人的日本外交官
n7950641,杨奎松：孙中山曾想把共产党开除出国民党
n7951449,佚名：未出境的大师们 文革全被害
n7958542,聂作平：礼崩乐坏时代的高官典型
n7962359,程万军：“史上最强外敌”怎五十年未征服中国？
n7965851,梁尧：您在工作中的选择明智吗？
n7967348,莲子：六四 情结（三）
n7966861,林辉：还原中共“英雄模范”之夏明翰
n7996012,杨光：文革与个人崇拜
n8002640,闵良臣：不清算文革不追究毛泽东是害怕追到自己头上
n8007265,许茹：古今暴君下场之夏桀
n8010636,许茹：古今暴君下场之商纣王
n8019247,《共产党宣言》首印出错 马克思称污秽之书
n8027706,文史漫谈：勤俭节约 克制贪欲
n8033926,林辉：还原中共“英雄模范”之埃德加•斯诺
n8037325,沈彻：带领中国成为世界第二大经济体的清政府为什么会倒台？
n8041621,同舟：说说“文革”期间被破坏的著名文物
n8041674,林辉：还原中共“英雄模范”之叶挺
n8051221,文史漫谈：妒嫉之心 害人害己
n8057374,许茹：古今暴君下场之尼禄
n8063314,鲍彤：“伟光正”的由来和两个决议的童话
n8069297,林辉：还原中共“英雄模范”之董存瑞
n8076313,林辉：还原中共“英雄模范”之韦拔群
n8076529,周正：心系苍生 天祐之
n8084246,张东园：中共迫害文化精英实录（一）
n8087731,积善仁爱 得以厚报
n8099263,张东园：中共迫害文化精英实录（二）
n8099741,蔡慎坤：德国人的“强国梦”为何成噩梦？
n8106087,许茹：古今暴君下场之周厉王
n8114397,太阳史家：罗马尼亚人民起义 共产党解体
n8130815,晓明：都庞萌渚也落泪，富江河水更悲咽
n8141317,林辉：释放万余中共政治犯的国民党高官之死
n8143459,张东园：中共迫害文化精英实录（三）
n8146356,慧文：写在唐山大地震四十周年
n8153832,华桂枝：君住长江尾（上）
n8158666,张东园：中共迫害文化精英实录（四）
n8166675,林辉：父亲铁丝穿鼻 中共高官亲牵游街
n8172698,张东园：中共迫害文化精英实录（五）
n8177791,北明：“不要相信我服罪”
n8182524,林辉：还原中共“英雄模范”之钱壮飞
n8189516,史求真 ：“文化大革命”实乃“暴力大破坏”
n8202772,抗战初期的四川省主席王缵绪——在毛政权下的窘境
n8205636,林辉：谱曲红歌的音乐人之厄运
n8211205,从陈平谈到东南亚排华及华裔身份认同
n8222139,林辉：还原中共“英雄模范”之张学良
n8231516,林辉：还原中共“英雄模范”之杨虎城
n8237870,郑义：在文革50周年反思研讨会上的两次发言
n8253155,史留香：疯狂的“破四旧”
n8260431,林辉：还原中共“英雄模范”之彭雪枫
n8274505,林辉：毛除之而后快的中共“五方特务”
n8286793,林辉：还原中共“感动中国人物”之王进喜
n8301515,胡平：文革中废除高考制度的幕后原因
n8308867,林辉：还原中共“感动中国人物”之毛岸英
n8315002,关乐：口蜜腹剑 七窍流血
n8321449,林辉：还原中共“感动中国人物”之刘文学
n8332426,林辉：还原中共“感动中国人物”之王杰
n8345604,太阳史家：捷克斯拉伐克《七七宪章》的胜利
n8348681,林辉：还原中共“感动中国人物”之时传祥
n8354486,唐仕：说说我的故事（上）
n8358690,唐仕：说说我的故事（中）
n8362205,林辉：还原中共“感动中国人物”之彭加木
n8365492,唐仕：说说我的故事（下）
n8367977,林辉：还原中共“感动中国人物”之容国团
n8374627,林辉：还原中共“感动中国人物”之草原小姐妹
n8379787,石平：反人类罪、群体灭绝罪正在中国发生
n8382011,林辉：还原中共“感动中国人物”之孔繁森
n8388830,杨宁：走完长征的国民党中将的可叹结局
n8402587,林辉：执笔《九评苏共》的王力可悲人生
n8406622,同真：由武昌起义谈中共倒台
n8418336,林辉：“二流堂”案闹剧背后被戕害的文化人
n8431232,佚名：中共历次运动剖析
n8431774,林辉：还原中共“感动中国人物”之焦裕禄
n8438140,纯真：读《封神演义》 借古鉴今
n8439386,欣明：德不配位 必有灾殃
n8443029,叶青：还记得七十年前的沈崇事件吗？
n8458859,林辉：还原中共“感动中国人物”之欧阳海
n8490119,杨宁：将希特勒逼上法庭盘问的德国律师（上）
n8493071,秦山：《贞观政要》与《康熙政要》(上)
n8496151,秦山：《贞观政要》与《康熙政要》(下)
n8496670,杨宁：将希特勒逼上法庭盘问的德国律师（下）
n8503133,金剑平：中共用“对日寇的最后一战”来发动内战(上)
n8503227,金剑平：中共用“对日寇的最后一战”来发动内战(中)
n8503279,金剑平：中共用“对日寇的最后一战”来发动内战(下)
n8503309,金剑平：中共用“对日寇的最后一战”来发动内战（完整版）
n8519039,周日清：华人世界再无蒋经国
n8530958,林辉：还原中共“感动中国人物”之任长霞
n8586425,关乐：“西安事变”和解主线之三
n8605707,关乐：“西安事变”和解主线之十一
n8621324,林辉：还原中共“感动中国人物”之谭千秋
n8659255,周晓辉：巴黎公社点燃的那场大火
n8662587,林辉：中共的生日为何变来变去？
n8666081,周晓辉：“十月革命”是列宁发动的军事政变
n8668553,玉清心：打开右派自杀档案 让人欲哭无泪
n8669027,林辉：中共武装保卫苏联与李大钊之死
n8671842,周晓辉：共产党“五大导师”之马克思（上）
n8674159,网文：这不是党史——方志敏的“宇宙真理”
n8671884,周晓辉：共产党“五大导师”之马克思（下）
n8677173,林辉：从湖南大知识分子叶德辉被杀说起
n8677531,高天韵：根正苗红的他说“文革是可耻10年”
n8680213,林辉：金陵大学副校长文怀恩被杀的背后
n8681739,高天韵：文革中 他们在南京走向刑场
n8683011,周晓辉：共产党“五大导师”之恩格斯（上）
n8682051,中共“镇反”运动按比例杀人内幕
n8683679,周晓辉：共产党“五大导师”之恩格斯（下）
n8686097,留在大陆的中华民国院士之大结局（一）
n8690231,留在大陆的中华民国院士之大结局（二）
n8690444,蔡慎坤：谁领导了8年抑或14年抗战？
n8690033,金庸父与梁羽生父 中共“镇反”运动中被杀
n8690511,林辉：“刑场上的婚礼”背后的真相
n8694077,留在大陆的中华民国院士之大结局（三）
n8694938,林辉：中共六大文件与红色“山大王”惨死
n8695945,高天韵：反右运动——浸血的世界纪录
n8698102,佚名：为什么蒋介石说“攘外必先安内”？
n8697723,中共官方记载 毛泽东至少六次感谢日本侵华
n8699149,林辉：曾喊出“打倒毛泽东”口号的军队
n8699834,留在大陆的中华民国院士之大结局（四）
n8699786,王友群：习近平父亲遭残酷迫害16年始末
n8697753,毛泽东周恩来放弃日本巨额战争赔偿内幕
n8702670,林辉：中共建国中之国与红色行长毛泽民
n8704531,高天韵：田汉之死–文化名人的文革厄运
n8705505,周晓辉：巴黎公社与中共的百年约定
n8706583,玉清心：葬身火海的云南兵团十名花季少女
n8708536,周晓辉：共产党“五大导师”之列宁（上）
n8711128,辛亥革命名将何海清 年过古稀遭中共杀害
n8711451,被中共杀害的国军抗日将领：41名少将（上）
n8708559,周晓辉：共产党“五大导师”之列宁（下）
n8711526,被中共迫害的两届政治局常委及其父辈
n8716176,玉清心：锡盟草原上知青的那69座坟茔
n8718425,林辉：中共长征是逃跑还是北上抗日？
n8718710,中共杀害民国上将宋鹤庚与护法军司令夏之时
n8720347,玉清心：从知青“七人轮奸案”看如何制造假案
n8711519,被中共杀害的国军抗日将领：44名中将（下）
n8721196,高天韵：文革“红八月”的冤魂—卞仲耘
n8729080,林辉：被中共迫害的“十大元帅”之结局(中)
n8730698,玉清心：宁夏兵团两冤案 八名北京知青被枪毙
n8731884,林辉：被中共迫害的“十大元帅”之结局(下)
n8733609,曾伯炎：右派，惨受株连的妻儿们
n8734221,陆文：伪火十六载 今朝丑戏完
n8735098,高天韵：她为何成了文革“要案”的主角？
n8735154,林辉：被中共迫害的国家正副主席（上）
n8738621,林辉：被中共迫害的国家正副主席（中）
n8738829,章天亮：从公义和常识出发
n8738712,武昌首义元勋邓玉麟 年过古稀遭中共杀害
n8742187,林辉：被中共迫害的国家正副主席（下）
n8742418,国军抗日名将喻英奇 拒叶剑英劝降遭中共杀害
n8744097,傅雷之死──文化名人的文革厄运
n8743566,周晓辉：共产党“五大导师”之斯大林（中）
n8749308,掸封尘：雾霾中国与灰埋庞贝
n8743542,周晓辉：共产党“五大导师”之斯大林（上）
n8751032,林辉：被中共迫害的国民党高官子女及亲属（上）
n8743600,周晓辉：共产党“五大导师”之斯大林（下）
n8752583,林辉：被中共迫害的国民党高官子女及亲属（中）
n8753343,多少“逃港”知青魂飘大海
n8752598,林辉：被中共迫害的国民党高官子女及亲属（下）
n8756829,“乒坛三杰”文革自杀之悲剧
n8759070,林辉：中共何曾备战与粉碎侵华日军计划？
n8759264,林辉：被中共迫害的民革中央六大高官（上）
n8758643,周恩来主导“一打三反”运动 杀人或逾十万
n8758753,北大才子王实味和他滴血的野百合花
n8760215,文革中被枪决的指挥家——陆洪恩
n8761362,中共杀害“文革思想者” 刑前残忍“消声”
n8762539,三百年一见的国学大师陈寅恪之死
n8764186,文革湘西“特一号”案 丁祖晓批个人崇拜被杀
n8765218,被中共迫害的民革中央六大高官（下）
n8765336,被中共迫害死的著名国学大师蒙文通
n8765789,文革悲音——钢琴诗人顾圣婴
n8768594,周晓辉：盘点明天系掌门人肖建华的政商圈
n8762351,巴金——中共镁光灯聚焦下的道具
n8771985,被中共迫害的国学大师马一浮
n8768837,被中共迫害的民盟六大高官（上）
n8775139,被中共迫害的民盟六大高官（下）
n8778117,悲叹文化灭亡 绝食而死的国学大师熊十力
n8780394,周晓辉：共产党“五大导师”之毛泽东（一）
n8779799,玉清心：韦君宜的《思痛录》为何洛阳纸贵
n8779818,文革究竟死多少人？邓小平：那是天文数字
n8783966,周晓辉：共产党“五大导师”之毛泽东（二）
n8785511,被杀害的“反文革”第一人──刘文辉（上）
n8787054,周晓辉：共产党“五大导师”之毛泽东（三）
n8788998,被杀害的“反文革”第一人—刘文辉（下）
n8790234,横河：土改、乡绅和农村的衰落
n8785286,被中共迫害的民主促进会四大高官
n8786901,延安整风的历史碎片：整疯、整死、处决
n8788821,大饥荒死亡人数或超四千万 中共内部数据泄密
n8793965,周晓辉：共产党“五大导师”之毛泽东（四）
n8795127,敢叫板蒋介石却被中共害死的国学大师刘文典
n8796143,纳粹集中营解密 “多人无意间参与谋杀”
n8797603,大饥荒饿死人 毛泽东秘密会议上发表恐怖言论
n8799259,冯真：还原《苦菜花》电影背后的真相
n8801714,被中共迫害的民建四大高官（上）
n8801970,史还真：中国人应知的重要事—中华文化受尊崇
n8803466,石元裕：说实话者死 60年的难忘记忆 (1)
n8804185,被中共迫害的民建四大高官（下）
n8807341,大饥荒年代 毛泽东生活奢靡大建奢华行宫
n8809061,周晓辉：中共七十年前曾承诺建立美国式民主
n8806850,石元裕：说实话者死 60年的难忘记忆（2）
n8811129,林辉：中共如同变色龙 十八次修改党章
n8810787,大饥荒年代中共高官享特供 北京流传一民谣
n8814832,石元裕：说实话者死 60年的难忘记忆(3)
n8815942,“大师的大师”叶企孙的陨落
n8817219,中共御用文人郭沫若的两个儿子惨死于文革
n8814651,程晓容：共产主义远比纳粹邪恶
n8818768,苏联逼债致大饥荒？中共两大谎言被戳穿
n8819841,目盲腿断 国学大师吴宓凄惨晚年
n8821993,石元裕：说实话者死 60年的难忘记忆（4）
n8822378,大饥荒时中共出口136亿斤粮 够3400万人吃1年
n8819978,曹禺——从“戏剧天才”到“精神残废”
n8828308,大饥荒周恩来下令毁证 继续征粮出口换黄金
n8828832,鲜为人知的“两弹一星”专家受迫害经历
n8831014,贫贱夫妻百事哀——文革中底层社会缩影
n8828201,遭性迫害的女知青是个庞大群体
n8825945,武林旧事：高手不堪凌辱怒杀红卫兵后自尽
n8832992,农工党“十大右派”与一中央委员的悲惨结局
n8830661,《阿诗玛》与杨丽坤的苦难人生
n8835483,中共封锁大饥荒消息 剥夺农民求生权
n8836589,林辉：谁是八年抗战的中流砥柱？
n8839496,一名共产党高官及其家族的命运悲剧
n8840492,林辉：中共不抗日反而通敌卖国
n8840623,林辉：“皖南事变”的始作俑者是中共
n8846148,李天明：从刘少奇的悲惨结局看中共的人整人
n8844339,南泥湾种鸦片 张思德之死背后有秘密
n8850163,上七万言书后坐监十年 十世班禅被毒杀
n8849381,长春围困战──“死城”的记忆
n8851944,大饥荒中共禁止开仓放粮 出动军队镇压饥民
n8848013,林辉：中共地道战地雷战的真相
n8857778,王友琴：八月祭
n8855161,国学大师康有为遭中共鞭尸 后代被批斗
n8859796,周晓辉：共产党“五大导师”之毛泽东(完整版)
n8855307,西藏文化被摧残 大昭寺作猪圈上师被批斗
n8860506,袁斌：中共在中华民族救亡史上有过担当吗？
n8861150,王友琴：受难者和暴君
n8858688,郝忠良：给《白毛女》伴奏一辈子才知受骗
n8863360,大饥荒期间发生大量人吃人事件 悲惨异常
n8864551,林辉：白毛女乃虚构 黄世仁本是大善人
n8861612,苏联共产党的杀人历史简述（上）
n8866463,王友琴：清华附中模式（上）
n8869371,袁斌：中国“东亚病夫”的形象是谁改变的？
n8869408,袁斌：中共建政使中华文明在政治上陷入颓势
n8870896,林辉：藏民大规模反抗中共的背后原因
n8873528,林辉：1949年后天主教神父的炼狱
n8870000,王友琴：清华附中模式（下）
n8858719,赵翠巧：唱《白毛女》、跟毛周跳舞的经历
n8869423,袁斌：跨过鸭绿江，中共是韩战名副其实的输家
n8876742,“红飞蛾”的悲剧——上万知青投身缅共打仗
n8878615,林辉：抗战时国军将军的言行让中共将领汗颜
n8875345,王友琴：曾在芝加哥大学留学的五名文革受难者（上）
n8885166,中共整肃AB团引富田事变 红20军700军官被杀
n8886211,杨宁：毛泽东被捕真相与一个普通家庭的悲剧
n8882643,林辉：救了中共高官的“红色医生”的结局
n8885264,曾在芝加哥大学留学的五名文革受难者（下）
n8889214,中共残酷整肃AB团 陈毅妻子吓得投井自尽
n8890329,九三学社和台盟知名人士的难言人生（上）
n8892634,柬埔寨共产党的杀人历史简述
n8893704,中共肃反 夏曦杀人如麻离奇溺亡
n8890562,九三学社和台盟知名人士的难言人生（下）
n8895498,史思：抛弃共产暴政 回归传统文明
n8896789,邓小平的连襟和弟弟走上了自杀之路
n8899939,林辉：中国第一座古刹白马寺的文革劫难
n8887603,丁抒：阳谋（连载）
n8900807,刘晓：还原被扭曲的“四大地主”形象
n8903009,曾铮：“不说话的右派”
n8901817,王友琴：六十三名受难者和北大文革（上）
n8921370,林辉：原国务院副总理后悔跟毛走与加入中共
n8905628,林辉：“五反”中行业龙头大佬决绝的一跳
n8923691,张国焘残酷“肃反” 徐向前之妻被虐杀
n8925057,杨宁：著名医生林巧稚文革做护工 拒入中共
n8929944,大饥荒饿死四千万人 中共做了什么
n8932752,林辉：延安整风的恐怖与《东方红》出现
n8934582,蔡咏梅：用视像揭开中国古拉格的黑幕
n8902587,王友琴：六十三名受难者和北大文革（下）
n8899967,玉清心：“严打运动”冤魂知多少
n8935319,文革中他为什么把母亲送上了断头台？
n8938853,掸封尘：张果老为什么倒骑驴？
n8941831,七名被判死刑的北京大学“右派分子”（上）
n8939479,杨宁：邓小平等中共高官子女们的文革经历
n8943573,玉月：“狄、林反党集团”背后的黑幕
n8943577,周恩来在贺龙惨死案中鲜为人知的真面目（上）
n8944781,林辉：“惨”字写就的京剧四大须生之晚景
n8946588,契卡如何成为列宁的杀人工具？
n8947333,周恩来在贺龙惨死案中鲜为人知的真面目（下）
n8949053,饿死百万人的信阳事件——三年大饥荒的缩影
n8947174,周晓辉：从纳粹和苏共到中共之大规模焚书
n8950854,原国务院副总理方毅称毛是历史上最大暴君
n8951070,魏谷：孔子、历史和中共（一）
n8956369,林辉：京剧四大名旦1949年后的苦痛人生
n8946714,契卡无法无天 苏联外交部都头痛不已
n8956469,李天明：名小提琴家马思聪的逃亡路
n8961098,林辉：真实的董存瑞与同名电影主角的遭遇
n8958233,砸碑毁林 刨坟曝尸 中共如何扫荡孔庙圣地
n8958855,广西文革中骇人听闻的性暴力
n8963571,汇文：当良心遭遇政治
n8963749,林辉：反抗中共的《星火》杂志与林昭之死
n8958269,中共“批孔”和建孔子学院的闹剧
n8966645,林辉：放弃马列的陈独秀与其逃港的女儿
n8942086,七名被判死刑的北京大学“右派分子”（下）
n8966475,广西文革中的吃人狂潮（上）
n8969170,末代皇帝文革中连病带吓而死 族人被抄家
n8972322,广西文革中的吃人狂潮（中）
n8973032,网文：中国古人怎样对待“父母之仇”
n8972824,中共元老李立三一家的生死劫难
n8974261,林辉：同仁堂传人自杀 母亲和夫人被打死
n8974775,李宇明：大饥荒时期的红色画家
n8969781,吴祖光与新凤霞——文艺伉俪的人生磨难
n8974296,林辉：李大钊与其被中共批斗的长子
n8979640,王友琴：文革“斗争会”（上）
n8969160,苏共暴政下的群体灭绝（上）
n8981494,“美猴王”父亲钻狗洞 伯父被摧残致死
n8980914,苏共暴政下的群体灭绝（下）
n8986280,林辉：山本五十六座机被击落与中美合作所
n8976181,广西文革中的吃人狂潮（下）
n8984886,苏共与德国纳粹的秘密协议
n8986368,林辉：造假的江姐受刑与《红岩》作者自杀
n8983637,王友琴：文革“斗争会”（下）
n8993891,王友琴：摧毁日记的革命（上）
n8994782,林辉：毛喊完“蒋主席万岁”后挑起内战
n8992485,组图：文革中自杀的留美归国科学家
n8997049,丁抒：执政初期的镇反与土改阳谋
n8998810,杨宁：在中国失去安全感的红色记者斯特朗
n8994257,王友琴：摧毁日记的革命（下）
n9001013,林辉：苏军东北施暴 中共置若罔闻
n9000152,丁抒：“三反”“五反”下指标逼供信
n9000308,金钟访问文革研究者王友琴
n9004541,红色恐怖的野蛮狂欢
n9005811,林辉：两位诺贝尔文学奖得主访苏归来后
n9005586,林辉：杨开慧指毛是双料流氓
n9008069,丁抒：打掉知识分子的自尊心
n9015426,林辉：瞿秋白“多余的话”与父母坟墓被掘
n9022484,林辉：民国最高院检察长与大法官凄惨的结局
n9022279,丁抒：胡风案——空前的文字狱
n9025923,丁抒：肃反——矛头转向内部
n9018949,共产主义的淫乱基因——性解放
n9029846,刘晓：不可饶恕的《阿里郎》与《东方红》
n9036062,林辉：中共与苏俄三个时期签订的卖国条约
n9036016,【书评】长春围城 其实一直都没有结束
n9040551,林辉：“抗美援朝”真相与朝鲜族师团结局
n9043069,北京上海公安局长死于文革的内幕
n9046126,丁抒：双百方针与延安整风
n9048665,林辉：下关惨案与李、闻之死背后的鬼影
n9052650,林辉：全聚德传人文革喂猪 烤鸭店牌匾被摘
n9058631,毛泽东卖国秘闻 为投靠苏联曾想定都哈尔滨
n9060070,林辉：北大中共党员沈崇色诱美军之用意
n9063895,林辉：文革刘宝瑞尸骨无存 侯宝林屡被批斗
n9066173,中共关于美国西点军校的三大谎言的背后真相
n9071644,费良勇：清除共产僵尸及其雕塑和思想
n9071211,林辉：中共没放过袁世凯黎元洪的后人
n9076523,林辉：美军档案中无名的上甘岭战役真相
n9082113,林辉：飞虎队英雄与投共飞行员的失足之恨
n9082737,李锐揭文革秦城监狱内幕：近30高官死亡
n9086733,周晓辉：还原共产党百年真相 中共官媒静悄悄
n9088687,丁抒：千方百计引蛇出洞
n9086837,林辉：中共威逼诱骗战俘回国与其之后遭遇
n9090863,林辉：当芭蕾舞剧《天鹅湖》主角遭遇文革
n9097017,杨宁：1968年的法国“文革”与西方性解放
n9100825,林辉：金日成清洗延安派与捣毁中共军人陵园
n9104715,刘晓：“三一八惨案”与“六四屠杀”发生后
n9106617,香港赤祸——中共操控“六七暴动”内幕
n9107164,“国歌”词曲作者与为毛语录谱曲者苦涩结局
n9107352,“七千人大会” 刘少奇口头报告触怒毛泽东
n9106054,共产党与恐怖主义的渊源
n9110897,“四清运动”内幕 毛泽东矛头指向刘少奇
n9112091,刘晓：两相对比 中共“新社会”才是黑暗的
n9117217,林辉：曾经被中共活体解剖的国军战俘
n9116522,“改造”知识分子思想 毛重演延安整风
n9123961,毛发动“四清运动”预演“文革”（完整版）
n9125025,杨宁：贺子珍命运多舛 一家人亦没躲过文革
n9129649,林辉：向毛与中共挑战的两名北大学生之死
n9124238,中共打垮知识分子独立人格 华罗庚自杀未遂
n9133031,毛泽东准备死掉三亿中国人跟美国打核战争
n9137556,李宇明：“抗美援朝”给中国人带来深重灾难
n9145584,林辉：宋庆龄逢大事必糊涂 宋美龄一语中的
n9124299,中共思想改造对知识分子“诛心”（完整版）
