n10265684,共产暴政录：中共为什么要败坏中国人的道德
n10272258,杨宁：庆祝毛死去的年轻人被判死缓后
n10280071,路目：孔子诛杀少正卯 惹恼了谁？
n10250277,中共淫乱的前生今世（7）高危的情妇们
n10284443,林辉：受蒋介石赞赏的“苗王”被逼自杀背后
n10283458,李庆霖“知青英雄”悲剧是如何造成的(上)
n10257597,中共淫乱的前生今世（8）党官淫乱校园
n10285705,李庆霖“知青英雄”悲剧是如何造成的(下)
n10291663,林辉：热爱自由的北大“右派”之出局人生
n10271780,中共淫乱的前生今世（9）四大基础
n10283450,改革开放总设计师还是“总扼制师”？(上)
n10285795,改革开放总设计师还是“总扼制师”？(下)
n10306820,【还原史实】 整风运动 魔鬼整人初试啼声
n10307016,心升：以史为镜看毛邪（上）
n10307769,中共淫乱的前生今世（10）溃堤效应
n10309909,心升：以史为镜看毛邪（中）
n10310732,共产暴政录：台湾土改与大陆土改的对比
n10311201,心升：以史为镜看毛邪（下）
n10313172,孙陇：文革中张国柱一家的自杀
n10307862,中共淫乱的前生今世（11）前车之鉴
n10319814,裴毅然：重庆谈判真相——破裂主责在“共”
n10326635,杨宁：“四二五”政治构陷 江派黑手待拿下
n10343446,刘白：晚清张謇的幻想
n10353384,郑恩宠：中国打压 招安律师与林昭精神
n10356748,林辉：并未救国的“五四运动”只是胡闹而已
n3077476,【史实】卡尔·马克思的成魔之路
n10358233,共产暴政录：土改是中共邪恶基因的实践
n10359777,张立先：拜谒李庄
n10361532,周晓辉：恩格斯资助马克思并为其顶包背后
n2962346,鲜为人知的马克思之一：专制的马克思
n10360803,共产暴政录：统购统销洗劫中国农民
n2962557,鲜为人知的马克思之二：自大的马克思
n2965989,鲜为人知的马克思之三：虚荣的马克思
n10371607,共产党暴政录：三反五反运动
n2974481,鲜为人知的马克思之四：好斗的马克思
n2974541,鲜为人知的马克思之五：自私的马克思
n10377672,林辉：民国三位大师眼中的共产主义很可怕
n10379858,剑平：抗美援朝？时间地点对手名义结果全错
n2976689,鲜为人知的马克思之六：信神的马克思
n10382929,共产暴政录：公私合营（工商改造）
n10393987,林辉：掩盖大饥荒真相 五省书记罪责难逃（上）
n10394634,共产暴政录：抢教堂庙宇的献堂献庙
n10395165,【还原史实】谁在对日抗战？谁在借机发展？
n10398402,林辉：掩盖大饥荒真相 五省书记罪责难逃（下）
n10403852,老绥远韩氏：文革阅读经历
n10405751,林辉：燕京大学校长相信中共后的结局
n10405198,蔡霞：文革是一场每个人命运的浩劫
n2977832,鲜为人知的马克思之七：渎神的马克思
n10414742,共产暴政录：文革抄家抢了多少财宝
n2978870,鲜为人知的马克思之八：魔性的马克思
n10418231,晓明：一个枪口余生者的人生之路
n10420942,本真：《推背图》预言中美朝日大战及结局（一）
n10420856,林辉：李大钊误导北大学生同时也在卖国
n10427499,严家伟：文革中的监狱往事
n10430861,新闻奇才拒赴台湾 命丧中共劳改营
n10435561,罗思义：一个到死还相信共产党伟大的“学者”
n10438143,刘晓：共产党“告密者001号”的结局
n10439090,严家伟：滥杀无辜草菅人命的“镇反运动”
n10446785,共产暴政录：从船王卢作孚自杀看中共劫财手段
n10448635,林辉：上书毛反对土改 农学家慧眼识中共
n10464792,本真：《推背图》预言中美朝日大战及结局（二）
n10470479,林辉：写信赞成毛退位的陈铭枢之结局
n10471335,《天安门杀戮》挖到六四事件的根
n10478618,本真：《推背图》预言中美朝日大战及结局（三）
n10479888,王锐：“儿童政治犯”的故事
n10486558,【还原史实】国共内战中被欺骗的美国政府
n10487343,抗日战争期间中共做了啥？ 由图表告诉你！(一)
n10491587,《共产党宣言》是共产邪灵向人类的宣战书
n10492678,仰岳：共产党如何干扰美国的对华政策
n10498401,孙盛起：撒旦横行，圣婴只能死去
n10498992,裴毅然：再说“四•一二”
n10491766,朝鲜战争锣鼓掩盖下的暴力土改
n10513103,唐铭：维权老兵需了解韩战的中国战俘刺青浪潮
n10515170,林辉：蔡元培东床快婿的惨痛人生
n10515765,孙盛起：自己选择的路，只好用上吊绳走完
n10513377,土改中的按比例杀人与反人类酷刑
n10513884,中共用战争的方式进行土改和镇反
n10513937,摧毁传统乡绅制与现代法治基础的痞子运动
n10525205,林辉：中共“志愿军”唯一回国女战俘的遭遇
n10538029,王友琴：文革中的王冷之死
n10551502,【还原史实】镇反土改 中共建政初年的恐怖统治
n10556515,凌晓辉：毒害人类灵魂的共产主义理论（上）
n10561691,林辉：苏联20万“笑话犯”被关背后的荒谬
n10569800,刘晓：中共效仿纳粹大规模焚书 结局相同
n10570999,凌晓辉：毒害人类灵魂的共产主义理论（中）
n10576459,晓明：桂林“文革”运动的回忆与思考
n10571152,凌晓辉：毒害人类灵魂的共产主义理论（下）
n10585277,郭小林：“发配”老马号
n10588772,广州市“李一哲”炮打文革的闹剧
n10590053,烧杀抢如何成为中共土地革命的“初心”
n10597749,林辉：因曾与美国上将同台 燕大教授一家凄惨
n10600549,文革中自杀的中共省委书记阎红彦
n10602910,【还原史实】“三反五反”掠夺企业主 引爆自杀潮
n10606663,大兴文革：踩撕婴儿 活埋祖孙 一夜杀百人
n10607931,林辉：中共红军“三大纪律”掩盖下的恶行
n10612921,炮灰与英雄——中美韩战军人的命运
n10615598,卞世传：江泽民篡改扬州抗日史的卑劣无耻
n10619679,林辉：教授从练习低头弯腰到乐极生悲
n10620856,历经磨难的学者——吴门三大右派
n10625340,玉清心：文革“破四旧”不堪回首 但不能遗忘
n10637364,中共“文艺沙皇”被囚9年 晚年反思悲剧终局
n10624963,捡纸鸣冤、“反毛”凉鞋与“毛语录仗”
n10645382,严家伟：杀人越货丧尽天良的“土改”
n10648920,俞心诚：凯撒之死
n10650677,林辉：开了北大自杀先例的史学教授
n10656949,胡健：少年反革命
n10666303,观雨堂主：大陆高校的“秘密信息员”
n10670499,林辉：但愿来生不姓“胡”
n10672001,袁斌：计划生育，酿成了多少灭绝人性的惨剧
n10672735,为反右开场祭旗：三人被处决 万人围观
n10686541,古玉文：名流上书中共的伤痕往事
n10689028,顾雪雍：89岁老人说往事 一字一泪斥残暴
n10695964,林辉：五四运动“第一烈士”是历史的赝品
n10698182,共产暴政录：中共在苏区杀人如麻
n10702629,【还原史实】反右运动 中国知识分子惨遭摧折
n10705738,古玉文：红谍郭汝瑰不忘初心 助共为虐食苦果
n10708622,陋兰：隐瞒和谎言，极权身体里的黄色血液
n10711194,“富田兵变”遭镇压 尸体填满整个山沟
n10712571,林辉：中共地雷战幕后清华师生的惨死
n10714814,川普总统在93号航班9·11悼念仪式上的讲话全文
n10715065,古玉文：公安局长卧底校长 百名少年惨成右派
n10711496,共产暴政录：喊错口号导致六千人被杀
n10730270,观雨堂主：“道德错乱”下的卞仲耘之死
n10742140,韩丽明：麻雀的哀歌
n10747311,裴毅然：中共抗战“游而不击”的史证（一）
n10747812,东欧剧变第一国 波兰抛弃共产主义之路
n10749135,林辉：邓小平女儿指北大曾变成法西斯集中营
n10752312,谭松：一个被摧折了“阳根”的老地主
n10752586,共产暴政录：毛泽东同学夏曦“肃反”创纪录
n10752911,智诚：“除夕宴”在恸哭声中进行
n10735061,古玉文：窃国初期中共几十万干部争当陈世美
n10752825,共产暴政录：张国焘鄂豫皖根据地肃反
n10743859,古玉文：公私合营献产业 武百祥命陨红朝
n10761251,谭松：对大地主刘文彩庄园的采访
n10761662,周晓辉：从崇祯皇帝救不了大明王朝说当下
n10757209,共产暴政录：红四方面军在四川杀民众百万
n10770724,裴毅然：毛泽东真诚“感谢皇军”
n10771577,和平砥柱——丘吉尔的“铁幕”演说
n10773796,邪恶帝国——里根总统谴责苏联共产政权
n10774701,推倒这堵墙——里根总统的柏林墙演讲
n10781989,林辉：北京反驳彭斯 需要补历史课的是谁？
n10784939,共产暴政录：“抗美援朝”真相
n10786224,老贫农：在大饥荒中人是怎样被活活饿死的？
n10785014,共产暴政录：镇压“反革命”运动
n10793353,林辉：金庸堂哥穆旦走到了幻想的尽头
n10798292,共产暴政录：五十年代的肃反运动
n10799353,潜伏在中华民国和台湾的中共间谍（1）
n10801600,潜伏在中华民国和台湾的中共间谍（2）
n10802534,韩丽明：游街
n10809395,潜伏在中华民国和台湾的中共间谍（3）
n10809856,严家伟：人间地狱，四川古蔺岔角滩
n10806244,林辉：当炮灰还成“叛徒”王成原型人生尽毁
n10812825,潜伏在中华民国和台湾的中共间谍（4）
n10813474,大饥荒是中共有计划的屠杀手段（上）
n10821837,林辉：文革偷听“敌台”让一些中国人觉醒
n10823173,【还原史实】中共“大跃进” 四千万中国人活活饿死
n10828040,大饥荒是中共有计划的屠杀手段（中）
n10829782,许茹：十月逾五十次地震 天象示警情势危
n10834250,林辉：一生没有得到思维乐趣的王小波之父
n10834918,曾伯炎：杀母红卫兵孔繁路的悲剧
n10840435,大饥荒是中共有计划的屠杀手段（下）
n10835148,中华传统文化之叹——消逝的城墙（上）
n10835295,中华传统文化之叹——消逝的城墙（下）
n10846318,共产暴政录：疯狂恐怖的“红八月”
n10847366,林辉：燕大西语系四教授 文革三死一疯
n10859288,慧勉：古代官员善心理政故事数则
n10862316,刘晓：祠堂被毁 不孝子孙愧对先祖
n10863025,晓明：永难忘怀的血泪史
n10878489,共产暴政录：文革中教师校长被打死
n10879954,林辉：共产党国家的“作秀公审”
n10882697,谢显宁：董时进、董时光兄弟生死劫
n10885699,陆文：生与死的抉择
n10889466,裴毅然：中共小知党（四）
n10894661,林傲霜：为了活命的冒险——瞒产私分
n10899776,林辉：姚依林回忆“一二九运动”证实三件事
n10902151,龙延：中共道路是魔鬼的选择
n10903516,观雨堂主：一位历史学家在生命终点的“争宠”
n10899641,抗日战争期间中共做了啥？八年抗战期间中共作为大事纪要
n10919284,陋兰：当告密者成为英雄
n10925502,林辉：满清最后一位格格坐了十五年冤狱
n10927236,共产暴政录：文革初北京昌平和大兴县大屠杀
n10929549,传奇总统里根（4）：福利改革 全美效仿
n10932836,张林：间谍国（二）
n10936495,林辉：抗日名将殉国身后妻儿惨到乞讨
n10939788,共产暴政录：湖南道县大屠杀
n10947448,晓明：与晏乐斌先生谈广西屠杀及文革“处遗”
n10947759,传奇总统里根（5）：竞选总统 众望所归
n10955771,林辉：携美资料返国 中国石油之父最终绝望
n10959110,冯八飞：请问候劳鹤——真正的知识分子爱因斯坦
n10965227,林启山：刘义元卖妻
n10965703,共产暴政录：广西文革大屠杀事件
n10966582,林辉：文革一个为妻子报仇的普通军人之死
n10977994,林辉：一篇文章惹毛动怒 民间顾准拒辱自尽
n10979189,共产暴政录：许世友文革中的暴行
n10979206,共产暴政录：“五一六”反革命阴谋集团案
n10981686,两位古琴大师的悲剧：毁琴自尽 文革失踪
n10989886,共产暴政录：“清理阶级队伍”运动
n10990583,林辉：岳飞忠魂千古颂 中共侮辱英雄可憎
n10992365,殷毅：我在右派专列上
n10992445,（储安平之子）储望华：沉重的回忆
n10992360,传奇总统里根（7）: 唤醒苏联领导人
n10994378,陆文：迫害佛法最终害了自己
n10995753,九州：注定失败的共产主义
n10997801,林辉：国军重庆号巡洋舰官兵投共后的苦难
n11000789,共产暴政录：消灭思想先驱的“一打三反”
n11000755,文革处决纪录：非战争下的中国之最
n11004578,林辉：宁跳珠江也不批孔子的金石界大家
n11000879,共产暴政录：文革中究竟死了多少人
n11009341,阎长贵：陶铸是被谁打倒的？
n11010192,共产暴政录：计划生育是毁我中华的屠婴战争（上）
n11011288,林辉：西安军事叛变前夜毛收到张杨密电
n11010874,共产暴政录：计划生育是毁我中华的屠婴战争（下）
n11010920,共产暴政录：“六四屠城”的几个问题
n11020634,林辉：与张大千比肩的画坛宗师饮恨而终
n11010938,古罗马迫害基督徒与中共迫害法轮功对比
n11022591,玉清心：物理大师束星北 一曲悲怆的挽歌
n11027279,孙盛起：总会有无畏的勇士记录历史的真实
n11029000,林辉：救了毛周的人 结局大多很惨
n11029582,荟楠：快跑！祖国来了！
n11034634,林辉：样板戏李玉和阿庆嫂等扮演者的命运
n11031942,传奇总统里根（8）：向中国播撒自由精神
n11038748,邢诒心：作为地主崽的童年
n11038882,严家伟：我亲历的《星星诗刊》大冤案
n11042647,林辉：咏春拳文革遭遇是武林劫难的缩影
n11044461,钟声：他们晚年为何忏悔
n11045840,晓明：1968年广西阳朔杀惨案回顾
n11049930,林辉：被诬施“美人计”一家七口以死抗争
n11052730,王友群：按邓小平的说法 中共早该下台了
n11061288,林辉：毁黄帝炎帝陵 中共与中华民族水火不容
n11062047,严家伟：一位宁为玉碎的“右派”份子
n11070799,林辉：因如此荒诞理由 他们成为了“右派”
n11084381,林辉：中共这些“特别党员”效力后自取其辱
n11088075,野狐一禅：刻我心碑上的右派精英
n11093693,林辉：“口吞红太阳”与“领袖最脏”罪
n11098413,共产暴政录：唐山大地震曾被预测出来
n11100959,共产暴政录：唐山大地震前后之怪相
n11102523,马吉卫：难以平复的伤疤
n11108237,张林：疯狂中共两次差点让中国人被灭绝
n11108254,裴毅然：击碎“中国梦”的五反血案
n11108271,林辉：从农民吃光“忆苦饭”看中国农村真相
n11118849,严家伟：极权专制对中国新闻界的一次严厉打压
n11120824,共产暴政录：5.12汶川地震后 中共嫁祸法轮功
n11123506,林辉：朱德曾被德国驱逐 效力中共晚景凄凉
n11125994,谁是中华文化的最大破坏者？
n11128349,明白人：“纪念”“烧木炭”而死的张思德
n11133337,林辉：质疑文革 红卫兵头目被摘肾暴尸
n11134725,共产暴政录：东南亚排华的重要根源是共产党
n11140380,【征文】刘晓：传统文化中对修炼人的敬重
n11142951,共产暴政录：中共鼓励外国残害海外华人
n11148175,共产暴政录：印尼排华暴乱事件
n11148760,林辉：抗战时毒杀日外交官 英雄难逃中共毒手
n11167928,林辉：寿则多辱 鲁迅之弟周作人凄惨中死去
n11169990,共产暴政录：老挝华人共产前后的处境变化
n11170944,观雨堂主：周作人的悲剧抉择
n11176292,【征文】田园：《资治通鉴》中的传统智慧
n11191240,林辉：诬陷美国发动细菌战 毛周被打脸
n11180153,【征文】章阁：中国古代专制吗（上）
n11180163,【征文】章阁：中国古代专制吗（下）
n11213719,许茹：火灾爆炸频发京城连震 昭示奸佞当道
n11225005,林辉：中共高规格接待蒙古独裁者背后的丑行
n11208751,【征文】张东园：中国国学大师的血泪遭遇(4)
n11226848,共产暴政录：越共排华事件
n11223087,【征文】杨宁：中华文物之殇史无前例
n11232692,林辉：为延安贩卖鸦片的毒贩死前缘何喊冤？
n11208799,【征文】张东园：中国国学大师的血泪遭遇（5）
n11238561,金钟：南京“木马屠城”七十年
n11238642,晓明：文革中广西204地质勘探队惨绝人寰的凶杀案
n11101863,【征文】章阁：中共设风水乱局 破坏北京古城
n11241790,共产暴政录：柬共屠杀300万民众及30万华人
n11241913,【征文】袁斌：中共怎样用党文化取代传统文化
n11242732,【征文】张东园：孔子为什么不是无神论？
n11248062,共产暴政录：共产革命前后的古巴华人
n11248166,【征文】袁斌：中共是怎么炮制“英雄人物”的
n11242784,【征文】张东园：传统文化中的善恶有报事例
n11255834,颜丹：日本作家村上春树新作引发的中国效应
n11256379,观雨堂主：历史并未忘记
n11255006,【征文】凌晓辉：贞洁论（一）
n11261433,王维洛：孙越崎，学生领袖、煤油大王与三峡工程反对派的重要领军人物
n11263424,【征文】刘晓：古代侠士与侠义精神
n11256527,【征文】凌晓辉：贞洁论（二）
n11257087,【征文】凌晓辉：贞洁论（三）
n11270152,中共暴政录：支持苏俄入侵中国的中东路事件
n11257164,【征文】凌晓辉：贞洁论（四）
n11275879,林辉：中共对三千印度战俘进行红色洗脑
n11276054,金言：蒋介石当年在江西的惊人预言
n11234439,【征文】文宇：史上最公平的选官制——科举千年兴衰录（四）
n11257250,【征文】凌晓辉：贞洁论（五）
n11280593,观雨堂主：吴晗——不止是个人的悲哀
n11281981,共产暴政录：苏俄及中共分裂外蒙古
n11285995,杨宁：从市委书记出丑说被膜拜的延安真相
n11295844,沧海：折寿三十年与延寿三十年
n11290434,【征文】爱德华：金门战役共军惨败之迷
n11300386,林辉：大饥荒 中共却无偿送几内亚万吨大米
n11293536,【征文】元正戊：弦高退秦军救郑国后为何拒受重赏
n11306932,共产暴政录：共产党主导的三区叛乱
n11308535,金雁：“既得利益者”何以成为反对苏维埃的先锋?
n11326982,金言：香港反送中会引发“蝴蝶效应”？
n11293194,【征文】章阁：荒谬的社会发展“五阶段论”
n11329746,传奇总统里根（10）：一封家书承载使命
n11334759,宋征时：迟浩田披露中共出卖大面积北方领土
n11340254,林辉：抗共而逝的香港前主播让亲共港媒汗颜
n11350548,王友群：陈独秀等10位中共党魁的最后结局
n11356564,共产暴政录：三区叛乱和侵华日军攻势协调进行
n11362608,林辉：文革集邮也是罪过
n11132788,【征文】千百度：上古三代时期的天命观（2）
n11372651,新州：豢养特务作恶 中共卑鄙无耻
n11403580,共产暴政录：盛世才与国共两党的新疆分裂争夺战
n11403595,林辉：中共高官披露内幕 毛奢侈嫉妒唯我独尊
n11415356,共产暴政录：岳父全家被杀 盛世才本人善终
n11425658,李小刚：中国大饥荒饿死3755.8万人？！
n11428903,林辉：周恩来冷酷无情 亲手给荣高棠扣叛徒帽子
n11431635,共产暴政录：盛世才与新疆的几个待解问题
n11434332,俞元：与中共“求同存异” 无疑引狼入室
n11436585,李小刚：十年文革灾难性后果探究
n11437710,林辉：国民党撤至台湾后破获的中共渗透大案
n11444363,共产暴政录：中共积极响应北塔山入侵事件
n11444846,夏祷：2019火种：天象巨变（1）
n11446216,夏祷：2019火种：天象巨变（2）
n11446723,曹长青：美国成为唯一超强的秘密
n11196004,【征文】张东园：中国国学大师的血泪遭遇(1)
n11196766,【征文】张东园：中国国学大师的血泪遭遇(2)
n11449283,袁斌：巫宁坤们的遭遇告诉后人什么
n11196827,【征文】张东园：中国国学大师的血泪遭遇(3)
n11462628,可心：香港警察有选择“枪口抬高一寸”的权利
n11470069,共产暴政录：西藏问题
n11473593,林辉：六七香港红潮 新华社分社发动菠萝战
n11477432,共产暴政录：李大钊被绞死的真正原因
n11478084,翻译家巫宁坤爱国竟受难 历劫著书留警训
n11262822,【征文】兰音：传统社会中妻子的真实地位
n11481511,晓明：回顾历史，拒绝遗忘
n11512510,杨宁：从瑞典最豪华战舰沉没说中共的结局
n11232880,【征文】史上最公平选官制 科举千年兴衰录(1)
n11234376,【征文】文宇：科举千年兴衰录（二）
n11234388,【征文】文宇：科举千年兴衰录（三）
n11528891,观雨堂主：中共对中国与世界的公开掠夺
n11538169,福瑞德：探寻中国百年历史的真相
n11539349,共产暴政录：从毛泽东诗词谈中共卖国
n11539563,鸿路：最后的双十节
n11541717,林辉：中共70年前承诺建立美国式民主在哪里？
n11543039,颜智华：中国特大饥荒60周年祭（一）
n11546701,林辉：中共70年来杀了多少人？
n11552181,林辉：中共70年来卖国黑历史
n11293517,【征文】林辉：外国名人如此仰慕中华文化
n11559430,林辉： 中共70年来的成功与未遂政变
n11563735,林辉：中共70年来的弥天大谎
n11564392,凌晓辉：当代人类的天书（一）
n11566782,凌晓辉：当代人类的天书（二）
n11575471,可心：从中共建政日与纽伦堡宣判同日说起（上）
n11584537,颜智华：中国特大饥荒60周年祭（二）
n11590692,林辉：一个曾给毛献花女孩对父亲的忏悔
n11606736,林辉：文革天津非法监狱“六十三号”的罪恶
n11612784,袁斌：韦君宜的后悔与林牧的反思
n11600972,【历史回眸】赵紫阳赞港英统治模式和蒋经国
n11616592,可心：从中共建政日与纽伦堡宣判同日说起（下）
n11616929,颜智华：中国特大饥荒60周年祭（三）
n11622063,林辉：中共对赵州桥的破坏令人叹惋
n11629364,139号囚犯——红色影星赵丹的凄惨人生
n11630909,林辉：中共对万里长城的破坏与利用
n11631409,正元：中共匪帮非我中华之邦
n11647719,钟声：“服从命令”与“终身追责”
n11646873,中共暴政录：最奇葩的战争——战胜国送出国土
n11648921,林辉：国家足球队头号前锋文革缘何自杀？
n11656265,杨宁：东德国防部长之选择给中共军方的启示
n11660999,林辉：承天命演绎忠义豪情《水浒》为何被批？
n11701121,宁静：中共改编《天仙配》摧毁孝道败坏人伦
n11701848,袁斌：从《共产党宣言》看共产主义的破坏性
n11704965,宁静：《花为媒》被中共禁播十五年只为淫乱华夏
n11704921,启明：共产党注定灭亡
n11707479,林辉：上海中国国货公司创办人死于文革前
n11707614,宁静：刘三姐到底是“歌仙”还是红卫兵？
n11709371,袁斌：汉学家林培瑞认清中共谎言的觉醒之路
n11712979,严晓：田汉之死     
n11729917,袁斌：“南京事件”与所谓“四一二反革命政变”
n11693550,为中共效力的红色特工 后来怎么样了（1）
n11751711,张林：青少年被迫加入抗美援朝志愿军
n11757068,王友群：面对“八国联军”清军为何兵败如山倒
n11758706,张林：共军在朝鲜战争中丧生两百万（1）
n11747470,为中共效力的红色特工 后来怎么样了（2）
n11766427,张林：共军在朝鲜战争中丧生两百万（2）
n11772976,林辉：中共当年盘剥延安人 被骂很“黑”
n11760806,为中共效力的红色特工 后来怎么样了（3）
n11814019,夏林：中共是国民党大选惨败的根本原因
n11829466,刘博：别让切尔诺贝利重演
n11835336,王赫：庚子年首月 中共地动山摇
n11851768,大瘟疫德国两城曾同命运 为何今日迥异
n11858311,王友群：习仲勋等支持气功研究的内幕
n11859230,李清：中共肺炎的警示
n11874645,王友群：习近平的父亲被栽赃陷害16年
n11888452,“土改”和“文革”时的离奇报应
n11888963,王友群：唐山大地震是天灾更是人祸
n11903759,朱镕基发言3分钟被打成右派20年
n11925917,掸封尘：毛泽东和江青有一个共同嗜好
n11939875,“红色殿堂”里的刀光剑影
n11942777,掸封尘：江青“醋坛子”的能量究竟有多大
n11942655,毛泽东73岁生日自杀的周小舟
n11945594,中央文革小组组长陈伯达被判刑18年
n11957171,让生命根植于信仰 再谈战地祈祷显神迹
n11961957,王友群：为了活下去 邓朴方曾到中南海上访
n11967983,掸封尘：窑师傅为什么“急得大口吐血”
n11989040,王友群：上海市公安局长扬帆被关押25年之谜
n12005282,王友群：中共文革把大陆变为“东方疯人院”
n12006157,谭笑飞：中共的“抗疫”与“抗日”如出一辙
n12030496,王友群：先整习仲勋后“叛党自杀”的阎红彦
n12036033,掸封尘：“仇恨入心要发芽”
n12037096,掸封尘：上将被中将当众打耳光
n12039776,铭刻1967：“武汉渡江惨案”
n12040184,王友群：中共公安部长李震离奇死亡之谜
n12042701,关乐：没谱红色英雄谱选注
n12064994,乔亓：刘伯温救劫碑记新解
n12065542,金正恩若亡，朝鲜可能出现第三个水晶棺
n12063151,王友群：毛泽东、江青的秘书戚本禹坐牢18年
n12069322,掸封尘：为中共党魁毛泽东造水晶棺的惊人内幕
n12072150,掸封尘：瘟疫相伴，2020年“两会”讪讪来迟
n12072285,掸封尘：朝鲜战争中鲜为人知的金、彭斗
